{
  "schema": "fnlla.module.v1",
  "version": "1.0.0",
  "id": "work-orders",
  "product_id": "property-maintenance",
  "description": "Declares the work-order workflow without registering runtime routes.",
  "default_enabled": false,
  "depends_on": ["tenancy", "properties"],
  "entities": ["work-order"],
  "actions": ["work-order.create", "work-order.schedule", "work-order.start", "work-order.complete"],
  "events": ["work-order.created", "work-order.scheduled", "work-order.started", "work-order.completed"],
  "capabilities": ["tenancy.row-scope", "audit.append-only", "search.exact-match"],
  "services": [],
  "routes": [],
  "assets": []
}
